{
  "schema_version": "1.0",
  "project_id": "002-the-new-war-beneath-the-ocean",
  "review_origin": "system_visual_qa",
  "review_basis": "Eighth ORVYQ system-owned byte-bound semantic review. The exact existing scene_050 video bytes and twelve-frame contact sheet were already approved as restrained regulatory-hearing context for CLM_007 and CLM_019. This round revalidates the same bytes after moving the CLM_007 use earlier within the same claim to interrupt an overlong evidence run; official NOAA and executive-order documents retain every legal, institutional, quantitative and permit-status claim.",
  "decisions": [
    {
      "scene_id": "scene_050",
      "provider_asset_id": "6951601",
      "asset_sha256": "3f75e1c6e9e2cce6aa69bb1003268f2dc1a491698898f5e551a5f385f5e545a9",
      "contact_sheet_sha256": "c2b37844943989267124367c70e0c81f2b7130bce9880aa863a254326d1d953a",
      "decision": "approve",
      "reason": "The reviewed frames show a real formal regulatory hearing and therefore carry the narration's institutional decision context without impersonating NOAA, the International Seabed Authority or a named proceeding. Moving the clip from the later question about liability to the earlier sentence about unresolved industrial-scale rules preserves the same claim, semantic role and factual-burden boundary while keeping the asset at two total uses."
    }
  ]
}
